{
  "$schema": "https://json-schema.org/draft/2020-12/schema",
  "$id": "https://contracts.saoaf.dev/schemas/v1/mcp/execution-evidence.json",
  "title": "MCP Tool Execution Evidence",
  "description": "MCP Gateway 每次执行产生的最小执行证据：与 resource_plan_id 关联、携带授权/审批引用与终态。敏感结果按数据策略直接返回 Harness，不进入 ARR/Registry——证据只含最小元数据与结果引用。",
  "type": "object",
  "additionalProperties": false,
  "required": ["tool_execution_id", "action_id", "resource_plan_id", "resource_plan_item_id", "tenant_ref", "state", "policy_decision_ref", "started_at", "finished_at"],
  "properties": {
    "tool_execution_id": {
      "type": "string",
      "pattern": "^te-[a-z0-9-]+$",
      "description": "执行标识（幂等重放返回同一 ID）。"
    },
    "action_id": { "type": "string" },
    "resource_plan_id": {
      "type": "string",
      "minLength": 1,
      "description": "关联键（非授权令牌——数据面每次执行重新鉴权）。"
    },
    "resource_plan_item_id": { "type": "string", "minLength": 1 },
    "tenant_ref": { "type": "string", "minLength": 1 },
    "state": {
      "type": "string",
      "enum": ["PREVIEWED", "APPROVED", "RUNNING", "SUCCEEDED", "FAILED", "CANCELLED"],
      "description": "执行状态机：preview → approve（高风险必经）→ execute → {succeeded|failed}；execute 与 cancel 存在竞争窗口，终态由 Gateway 仲裁。"
    },
    "policy_decision_ref": {
      "type": "string",
      "minLength": 1,
      "description": "04 工程 PDP 授权决定引用。"
    },
    "approval_ref": {
      "type": "string",
      "description": "审批引用（HIGH 风险执行必填；LOW/MEDIUM 可空）。"
    },
    "idempotency_key": {
      "type": "string",
      "description": "幂等键（重放返回原执行）。"
    },
    "result_ref": {
      "type": "object",
      "additionalProperties": false,
      "description": "结果引用（引用与完整性 digest，非结果正文）。",
      "required": ["uri", "digest"],
      "properties": {
        "uri": {
          "type": "string",
          "pattern": "^evidence://[^\\s]+$",
          "description": "结果证据 URI（Harness 按数据策略取回）。"
        },
        "digest": { "type": "string", "pattern": "^sha256:[0-9a-f]{64}$" }
      }
    },
    "error": {
      "type": "object",
      "additionalProperties": false,
      "required": ["error_code", "message", "request_id"],
      "description": "失败/取消时的冻结错误信封（flat 三键）。",
      "properties": {
        "error_code": { "type": "string", "minLength": 1 },
        "message": { "type": "string", "maxLength": 512 },
        "request_id": { "type": "string", "minLength": 1, "maxLength": 128 }
      }
    },
    "started_at": { "type": "string", "format": "date-time" },
    "finished_at": { "type": "string", "format": "date-time" },
    "trace_id": { "type": "string", "description": "W3C trace 关联。" }
  }
}
